{
  "schema_version": "pvec-gold/converter-status/1",
  "converter": "acadsharp-dwg2step",
  "status": "OK",
  "exit_code": 0,
  "input": {"path": "/v/fixtures/edge/huge-extent-001/source.dwg", "sha256": "1cb48c5d921317f44128255603fb3faddf9af01490f95799f79edcf96d6bde3e"},
  "output": {"path": "/v/.out-corpus-open/edge/huge-extent-001/primary.step", "sha256": "4b4cc8e413550081b6badd2f0dd98fe6f8841fde15c886ee18ee59b7f08f4d8b"},
  "product": {"name": "ACadSharp", "version": "3.7.1\u002Bd7dc111"},
  "declared_schema": "AP242_MANAGED_MODEL_BASED_3D_ENGINEERING_MIM_LF { 1 0 10303 442 1 1 4 }",
  "wall_time_seconds": "0.113",
  "warnings": ["INSUNITS is unitless: values are written unscaled and labelled metre"],
  "error": null
}
