{
  "schema_version": "pvec-gold/converter-status/1",
  "converter": "acadsharp-dwg2step",
  "status": "ERROR",
  "exit_code": 15,
  "input": {"path": "/v/fixtures/real-world/arch-aecobjects-001/source.dwg", "sha256": "dc196e99b8944d169493c9f3205d45f8a579c0c96e81dbc7fc2f90cd971f7a7e"},
  "output": null,
  "product": {"name": "ACadSharp", "version": "3.7.1\u002Bd7dc111"},
  "declared_schema": null,
  "wall_time_seconds": "0.137",
  "warnings": ["reader Warning: Unlisted object with DXF name RAPIDRTRENDERSETTINGS has been read as an UnknownNonGraphicalObject", "reader Warning: Unlisted object with DXF name AEC_DOOR has been read as an UnknownEntity", "reader Warning: Unlisted object with DXF name AEC_WINDOW has been read as an UnknownEntity", "reader Warning: Unlisted object with DXF name AEC_WINDOW has been read as an UnknownEntity", "reader Warning: Unlisted object with DXF name ACDBASSOCNETWORK has been read as an UnknownNonGraphicalObject", "reader Warning: Unlisted object with DXF name ACDBDETAILVIEWSTYLE has been read as an UnknownNonGraphicalObject", "reader Warning: Unlisted object with DXF name RAPIDRTRENDERSETTINGS has been read as an UnknownNonGraphicalObject", "reader Warning: Unlisted object with DXF name RAPIDRTRENDERSETTINGS has been read as an UnknownNonGraphicalObject", "reader Warning: Unlisted object with DXF name RAPIDRTRENDERSETTINGS has been read as an UnknownNonGraphicalObject", "reader Warning: Unlisted object with DXF name RAPIDRTRENDERSETTINGS has been read as an UnknownNonGraphicalObject", "reader Warning: Unlisted object with DXF name RAPIDRTRENDERSETTINGS has been read as an UnknownNonGraphicalObject", "reader Warning: Unlisted object with DXF name RAPIDRTRENDERSETTINGS has been read as an UnknownNonGraphicalObject", "reader Warning: Unlisted object with DXF name ACDBSECTIONVIEWSTYLE has been read as an UnknownNonGraphicalObject", "reader Warning: Unlisted object with DXF name AEC_2DSECTION_STYLE has been read as an UnknownNonGraphicalObject", "reader Warning: Unlisted object with DXF name AEC_CLASSIFICATION_SYSTEM_DEF has been read as an UnknownNonGraphicalObject", "reader Warning: Unlisted object with DXF name AEC_CURTAIN_WALL_LAYOUT_STYLE has been read as an UnknownNonGraphicalObject", "reader Warning: Unlisted object with DXF name AEC_CURTAIN_WALL_UNIT_STYLE has been read as an UnknownNonGraphicalObject", "reader Warning: Unlisted object with DXF name AEC_DIM_STYLE has been read as an UnknownNonGraphicalObject", "reader Warning: Unlisted object with DXF name AEC_DISP_REP_CONFIG has been read as an UnknownNonGraphicalObject", "reader Warning: Unlisted object with DXF name AEC_DISP_REP_CONFIG has been read as an UnknownNonGraphicalObject", "reader Warning: Unlisted object with DXF name AEC_DISP_REP_CONFIG has been read as an UnknownNonGraphicalObject", "reader Warning: Unlisted object with DXF name AEC_DISP_REP_CONFIG has been read as an UnknownNonGraphicalObject", "reader Warning: Unlisted object with DXF name AEC_DISP_REP_CONFIG has been read as an UnknownNonGraphicalObject", "reader Warning: Unlisted object with DXF name AEC_DISP_REP_CONFIG has been read as an UnknownNonGraphicalObject", "reader Warning: Unlisted object with DXF name AEC_DISP_REP_CONFIG has been read as an UnknownNonGraphicalObject", "reader Warning: Unlisted object with DXF name AEC_DISP_REP_CONFIG has been read as an UnknownNonGraphicalObject", "reader Warning: Unlisted object with DXF name AEC_DISP_REP_CONFIG has been read as an UnknownNonGraphicalObject", "reader Warning: Unlisted object with DXF name AEC_DISP_REP_CONFIG has been read as an UnknownNonGraphicalObject", "reader Warning: Unlisted object with DXF name AEC_DISP_REP_CONFIG has been read as an UnknownNonGraphicalObject", "reader Warning: Unlisted object with DXF name AEC_DISP_REP_CONFIG has been read as an UnknownNonGraphicalObject", "reader Warning: Unlisted object with DXF name AEC_DISP_REP_CONFIG has been read as an UnknownNonGraphicalObject", "reader Warning: Unlisted object with DXF name AEC_DISP_REP_SET has been read as an UnknownNonGraphicalObject", "reader Warning: Unlisted object with DXF name AEC_DISP_REP_SET has been read as an UnknownNonGraphicalObject", "reader Warning: Unlisted object with DXF name AEC_DISP_REP_SET has been read as an UnknownNonGraphicalObject", "reader Warning: Unlisted object with DXF name AEC_DISP_REP_SET has been read as an UnknownNonGraphicalObject", "reader Warning: Unlisted object with DXF name AEC_DISP_REP_SET has been read as an UnknownNonGraphicalObject", "reader Warning: Unlisted object with DXF name AEC_DISP_REP_SET has been read as an UnknownNonGraphicalObject", "reader Warning: Unlisted object with DXF name AEC_DISP_REP_SET has been read as an UnknownNonGraphicalObject", "reader Warning: Unlisted object with DXF name AEC_DISP_REP_SET has been read as an UnknownNonGraphicalObject", "reader Warning: Unlisted object with DXF name AEC_DISP_REP_SET has been read as an UnknownNonGraphicalObject", "reader Warning: Unlisted object with DXF name AEC_DISP_REP_SET has been read as an UnknownNonGraphicalObject", "reader Warning: Unlisted object with DXF name AEC_DISP_REP_SET has been read as an UnknownNonGraphicalObject", "reader Warning: Unlisted object with DXF name AEC_DISP_REP_SET has been read as an UnknownNonGraphicalObject", "reader Warning: Unlisted object with DXF name AEC_DISP_REP_SET has been read as an UnknownNonGraphicalObject", "reader Warning: Unlisted object with DXF name AEC_DISP_REP_SET has been read as an UnknownNonGraphicalObject", "reader Warning: Unlisted object with DXF name AEC_DISP_REP_SET has been read as an UnknownNonGraphicalObject", "reader Warning: Unlisted object with DXF name AEC_DISP_REP_SET has been read as an UnknownNonGraphicalObject", "reader Warning: Unlisted object with DXF name AEC_DISP_REP_SET has been read as an UnknownNonGraphicalObject", "reader Warning: Unlisted object with DXF name ABST_DISP_REP_CABLE_TRAY_FITTING has been read as an UnknownNonGraphicalObject", "reader Warning: Unlisted object with DXF name ABST_DISP_REP_CABLE_TRAY has been read as an UnknownNonGraphicalObject", "skipped 1 entity(ies) of type Wall"],
  "error": {"code": 15, "class": "CONVERSION_FAILED", "message": "no supported curve in model space"}
}
