{
  "schema_version": "pvec-gold/converter-status/1",
  "converter": "acadsharp-dwg2step",
  "status": "ERROR",
  "exit_code": 15,
  "input": {"path": "/v/fixtures/real-world/blocks-dynamic-linear-001/source.dwg", "sha256": "36dc72bad541b911b051936287eeb8abf9a9e80e92f371033dfc1d49a0e965bf"},
  "output": null,
  "product": {"name": "ACadSharp", "version": "3.7.1\u002Bd7dc111"},
  "declared_schema": null,
  "wall_time_seconds": "0.124",
  "warnings": ["reader Warning: Unlisted object with DXF name ACDBDETAILVIEWSTYLE has been read as an UnknownNonGraphicalObject", "reader Warning: Unlisted object with DXF name ACDBSECTIONVIEWSTYLE has been read as an UnknownNonGraphicalObject", "reader Warning: Entry not found Imperial24|428 for dictionary ACAD_DETAILVIEWSTYLE|427", "reader Warning: Entry not found Imperial24|426 for dictionary ACAD_SECTIONVIEWSTYLE|424", "reader Warning: ACadSharp.Tables.TextStyle table reference with handle:  | name:  not found for ACadSharp.Objects.TableStyle\u002BCellStyle"],
  "error": {"code": 15, "class": "CONVERSION_FAILED", "message": "drawing unit Inches is not supported (metre, millimetre, centimetre, kilometre and unitless are)"}
}
